<?xml version="1.0" encoding="utf-8"?>
<niveau xmlns="http://www.univ-grenoble-alpes.fr/niveau" 
        xmlns:xsi="http://www.w3.org/2001/XMLSchema-instance"
        xsi:schemaLocation="http://www.univ-grenoble-alpes.fr/niveau ../xsd/Niveau.xsd">
    <tempsDeJeu>10</tempsDeJeu>
    <rangée>
        <table>0</table>
        <table>2</table>
        <table>1</table>
        <table>2</table>
    </rangée>
    <rangée>
        <table>0</table>
    </rangée>
    <rangée>
        <table>2</table>
        <table>0</table>
        <table>0</table>
        <table>1</table>
        <table>2</table>
        <table>1</table>
    </rangée>
    <rangée>
        <table>0</table>
        <table>0</table>
        <table>0</table>
        <table>0</table>
        <table>0</table>
        <table>0</table>
        <table>0</table>
        <table>1</table>
        <table>0</table>
    </rangée>
</niveau>